{
  "$schema": "https://json-schema.org/draft/2020-12/schema",
  "title": "DataPass immutable result artifact v1",
  "type": "object",
  "additionalProperties": false,
  "properties": {
    "format": {
      "const": "datapass.artifact"
    },
    "version": {
      "const": 1
    },
    "id": {
      "type": "string",
      "pattern": "^[a-z][a-zA-Z0-9_-]{0,79}$",
      "not": {
        "enum": [
          "constructor",
          "prototype",
          "__proto__"
        ]
      }
    },
    "title": {
      "type": "string",
      "maxLength": 160,
      "pattern": "\\S"
    },
    "provenance": {
      "type": "object",
      "additionalProperties": false,
      "properties": {
        "kind": {
          "enum": [
            "synthetic",
            "provided",
            "computed"
          ]
        },
        "source": {
          "type": "string",
          "maxLength": 2000,
          "pattern": "\\S"
        },
        "runId": {
          "type": "string",
          "pattern": "^[a-z][a-zA-Z0-9_-]{0,79}$",
          "not": {
            "enum": [
              "constructor",
              "prototype",
              "__proto__"
            ]
          }
        },
        "producer": {
          "type": "object",
          "additionalProperties": false,
          "properties": {
            "kind": {
              "enum": [
                "script",
                "notebook",
                "service"
              ]
            },
            "name": {
              "type": "string",
              "maxLength": 160,
              "pattern": "\\S"
            },
            "evidence": {
              "type": "array",
              "items": {
                "type": "object",
                "additionalProperties": false,
                "properties": {
                  "path": {
                    "type": "string",
                    "minLength": 1,
                    "maxLength": 260,
                    "pattern": "^(?!\\.{1,2}(?:\\/|$))[^/\\\\:\\u0000-\\u001f\\u007f]+(?:\\/(?!\\.{1,2}(?:\\/|$))[^/\\\\:\\u0000-\\u001f\\u007f]+)*$"
                  },
                  "start": {
                    "type": "integer",
                    "minimum": 1,
                    "maximum": 100000
                  },
                  "end": {
                    "type": "integer",
                    "minimum": 1,
                    "maximum": 100000
                  },
                  "label": {
                    "type": "string",
                    "maxLength": 160,
                    "pattern": "\\S"
                  }
                },
                "required": [
                  "path",
                  "start",
                  "end",
                  "label"
                ]
              },
              "maxItems": 8,
              "minItems": 0
            }
          },
          "required": [
            "kind",
            "name"
          ]
        },
        "inputHash": {
          "type": "string",
          "pattern": "^[0-9a-f]{64}$"
        },
        "inputs": {
          "type": "array",
          "items": {
            "type": "object",
            "additionalProperties": false,
            "properties": {
              "id": {
                "type": "string",
                "pattern": "^[a-z][a-zA-Z0-9_-]{0,79}$",
                "not": {
                  "enum": [
                    "constructor",
                    "prototype",
                    "__proto__"
                  ]
                }
              },
              "label": {
                "type": "string",
                "maxLength": 160,
                "pattern": "\\S"
              },
              "value": {
                "type": [
                  "string",
                  "number",
                  "boolean"
                ],
                "maxLength": 400
              },
              "unit": {
                "type": "string",
                "maxLength": 40
              },
              "evidence": {
                "type": "array",
                "items": {
                  "type": "object",
                  "additionalProperties": false,
                  "properties": {
                    "path": {
                      "type": "string",
                      "minLength": 1,
                      "maxLength": 260,
                      "pattern": "^(?!\\.{1,2}(?:\\/|$))[^/\\\\:\\u0000-\\u001f\\u007f]+(?:\\/(?!\\.{1,2}(?:\\/|$))[^/\\\\:\\u0000-\\u001f\\u007f]+)*$"
                    },
                    "start": {
                      "type": "integer",
                      "minimum": 1,
                      "maximum": 100000
                    },
                    "end": {
                      "type": "integer",
                      "minimum": 1,
                      "maximum": 100000
                    },
                    "label": {
                      "type": "string",
                      "maxLength": 160,
                      "pattern": "\\S"
                    }
                  },
                  "required": [
                    "path",
                    "start",
                    "end",
                    "label"
                  ]
                },
                "maxItems": 8,
                "minItems": 0
              }
            },
            "required": [
              "id",
              "label"
            ]
          },
          "maxItems": 24,
          "minItems": 0
        },
        "dependsOn": {
          "type": "array",
          "items": {
            "type": "string",
            "pattern": "^[a-z][a-zA-Z0-9_-]{0,79}$",
            "not": {
              "enum": [
                "constructor",
                "prototype",
                "__proto__"
              ]
            }
          },
          "maxItems": 12,
          "uniqueItems": true
        }
      },
      "required": [
        "kind",
        "source"
      ]
    },
    "payload": {
      "oneOf": [
        {
          "type": "object",
          "additionalProperties": false,
          "properties": {
            "kind": {
              "const": "table"
            },
            "rowKey": {
              "type": "string",
              "pattern": "^[a-z][a-zA-Z0-9_-]{0,79}$",
              "not": {
                "enum": [
                  "constructor",
                  "prototype",
                  "__proto__"
                ]
              }
            },
            "columns": {
              "type": "array",
              "items": {
                "type": "object",
                "additionalProperties": false,
                "properties": {
                  "id": {
                    "type": "string",
                    "pattern": "^[a-z][a-zA-Z0-9_-]{0,79}$",
                    "not": {
                      "enum": [
                        "constructor",
                        "prototype",
                        "__proto__"
                      ]
                    }
                  },
                  "label": {
                    "type": "string",
                    "maxLength": 120,
                    "pattern": "\\S"
                  },
                  "type": {
                    "enum": [
                      "string",
                      "number",
                      "boolean"
                    ]
                  },
                  "unit": {
                    "type": "string",
                    "maxLength": 40
                  },
                  "nullable": {
                    "type": "boolean"
                  }
                },
                "required": [
                  "id",
                  "label",
                  "type"
                ]
              },
              "maxItems": 40,
              "minItems": 1
            },
            "rows": {
              "type": "array",
              "items": {
                "type": "object",
                "maxProperties": 40,
                "propertyNames": {
                  "type": "string",
                  "pattern": "^[a-z][a-zA-Z0-9_-]{0,79}$",
                  "not": {
                    "enum": [
                      "constructor",
                      "prototype",
                      "__proto__"
                    ]
                  }
                },
                "additionalProperties": {
                  "type": [
                    "number",
                    "string",
                    "boolean",
                    "null"
                  ],
                  "maxLength": 4000
                }
              },
              "maxItems": 10000,
              "minItems": 0
            }
          },
          "required": [
            "kind",
            "rowKey",
            "columns",
            "rows"
          ]
        },
        {
          "type": "object",
          "additionalProperties": false,
          "properties": {
            "kind": {
              "const": "text"
            },
            "text": {
              "type": "string",
              "maxLength": 20000
            }
          },
          "required": [
            "kind",
            "text"
          ]
        }
      ]
    },
    "representations": {
      "type": "array",
      "items": {
        "oneOf": [
          {
            "type": "object",
            "additionalProperties": false,
            "properties": {
              "id": {
                "type": "string",
                "pattern": "^[a-z][a-zA-Z0-9_-]{0,79}$",
                "not": {
                  "enum": [
                    "constructor",
                    "prototype",
                    "__proto__"
                  ]
                }
              },
              "title": {
                "type": "string",
                "maxLength": 160,
                "pattern": "\\S"
              },
              "kind": {
                "const": "table"
              },
              "inputs": {
                "type": "array",
                "items": {
                  "type": "string",
                  "pattern": "^[a-z][a-zA-Z0-9_-]{0,79}$",
                  "not": {
                    "enum": [
                      "constructor",
                      "prototype",
                      "__proto__"
                    ]
                  }
                },
                "maxItems": 24,
                "uniqueItems": true
              }
            },
            "required": [
              "id",
              "title",
              "kind"
            ]
          },
          {
            "type": "object",
            "additionalProperties": false,
            "properties": {
              "id": {
                "type": "string",
                "pattern": "^[a-z][a-zA-Z0-9_-]{0,79}$",
                "not": {
                  "enum": [
                    "constructor",
                    "prototype",
                    "__proto__"
                  ]
                }
              },
              "title": {
                "type": "string",
                "maxLength": 160,
                "pattern": "\\S"
              },
              "kind": {
                "const": "text"
              },
              "inputs": {
                "type": "array",
                "items": {
                  "type": "string",
                  "pattern": "^[a-z][a-zA-Z0-9_-]{0,79}$",
                  "not": {
                    "enum": [
                      "constructor",
                      "prototype",
                      "__proto__"
                    ]
                  }
                },
                "maxItems": 24,
                "uniqueItems": true
              }
            },
            "required": [
              "id",
              "title",
              "kind"
            ]
          },
          {
            "type": "object",
            "additionalProperties": false,
            "properties": {
              "id": {
                "type": "string",
                "pattern": "^[a-z][a-zA-Z0-9_-]{0,79}$",
                "not": {
                  "enum": [
                    "constructor",
                    "prototype",
                    "__proto__"
                  ]
                }
              },
              "title": {
                "type": "string",
                "maxLength": 160,
                "pattern": "\\S"
              },
              "kind": {
                "const": "json"
              },
              "inputs": {
                "type": "array",
                "items": {
                  "type": "string",
                  "pattern": "^[a-z][a-zA-Z0-9_-]{0,79}$",
                  "not": {
                    "enum": [
                      "constructor",
                      "prototype",
                      "__proto__"
                    ]
                  }
                },
                "maxItems": 24,
                "uniqueItems": true
              }
            },
            "required": [
              "id",
              "title",
              "kind"
            ]
          },
          {
            "type": "object",
            "additionalProperties": false,
            "properties": {
              "id": {
                "type": "string",
                "pattern": "^[a-z][a-zA-Z0-9_-]{0,79}$",
                "not": {
                  "enum": [
                    "constructor",
                    "prototype",
                    "__proto__"
                  ]
                }
              },
              "title": {
                "type": "string",
                "maxLength": 160,
                "pattern": "\\S"
              },
              "kind": {
                "const": "chart"
              },
              "inputs": {
                "type": "array",
                "items": {
                  "type": "string",
                  "pattern": "^[a-z][a-zA-Z0-9_-]{0,79}$",
                  "not": {
                    "enum": [
                      "constructor",
                      "prototype",
                      "__proto__"
                    ]
                  }
                },
                "maxItems": 24,
                "uniqueItems": true
              },
              "chart": {
                "enum": [
                  "bar",
                  "line",
                  "scatter"
                ]
              },
              "x": {
                "type": "string",
                "pattern": "^[a-z][a-zA-Z0-9_-]{0,79}$",
                "not": {
                  "enum": [
                    "constructor",
                    "prototype",
                    "__proto__"
                  ]
                }
              },
              "y": {
                "type": "string",
                "pattern": "^[a-z][a-zA-Z0-9_-]{0,79}$",
                "not": {
                  "enum": [
                    "constructor",
                    "prototype",
                    "__proto__"
                  ]
                }
              },
              "unit": {
                "type": "string",
                "maxLength": 30
              }
            },
            "required": [
              "id",
              "title",
              "kind",
              "chart",
              "x",
              "y"
            ]
          },
          {
            "type": "object",
            "additionalProperties": false,
            "properties": {
              "id": {
                "type": "string",
                "pattern": "^[a-z][a-zA-Z0-9_-]{0,79}$",
                "not": {
                  "enum": [
                    "constructor",
                    "prototype",
                    "__proto__"
                  ]
                }
              },
              "title": {
                "type": "string",
                "maxLength": 160,
                "pattern": "\\S"
              },
              "kind": {
                "const": "metric"
              },
              "inputs": {
                "type": "array",
                "items": {
                  "type": "string",
                  "pattern": "^[a-z][a-zA-Z0-9_-]{0,79}$",
                  "not": {
                    "enum": [
                      "constructor",
                      "prototype",
                      "__proto__"
                    ]
                  }
                },
                "maxItems": 24,
                "uniqueItems": true
              },
              "row": {
                "type": "string",
                "maxLength": 160,
                "pattern": "\\S"
              },
              "column": {
                "type": "string",
                "pattern": "^[a-z][a-zA-Z0-9_-]{0,79}$",
                "not": {
                  "enum": [
                    "constructor",
                    "prototype",
                    "__proto__"
                  ]
                }
              },
              "unit": {
                "type": "string",
                "maxLength": 40
              },
              "digits": {
                "type": "integer",
                "minimum": 0,
                "maximum": 6
              }
            },
            "required": [
              "id",
              "title",
              "kind",
              "row",
              "column"
            ]
          }
        ]
      },
      "maxItems": 12,
      "minItems": 1
    }
  },
  "required": [
    "format",
    "version",
    "id",
    "title",
    "provenance",
    "payload",
    "representations"
  ]
}
