{
  "format": "datapass.artifact",
  "version": 1,
  "id": "wind-aep-weibull",
  "title": "ILLUSTRATIVE annual energy vs mean wind speed (Weibull k=2)",
  "provenance": {
    "kind": "computed",
    "source": "py/wind_reference_model.py (run as a script, from Jupyter or from marimo). ILLUSTRATIVE: generic 3 MW-class power curve, no losses. Not FOIL data, not a site assessment. Weibull k=2.",
    "producer": {
      "kind": "script",
      "name": "py/wind_reference_model.py",
      "evidence": [
        {
          "path": "py/wind_reference_model.py",
          "start": 48,
          "end": 56,
          "label": "Trapezoid AEP integral"
        },
        {
          "path": "py/wind_reference_model.py",
          "start": 59,
          "end": 70,
          "label": "Table of cases"
        }
      ]
    },
    "inputs": [
      {
        "id": "k",
        "label": "Weibull shape k",
        "value": 2.0,
        "evidence": [
          {
            "path": "py/wind_reference_model.py",
            "start": 38,
            "end": 41,
            "label": "Weibull density"
          }
        ]
      },
      {
        "id": "ratedPower",
        "label": "Rated power",
        "value": 3000.0,
        "unit": "kW",
        "evidence": [
          {
            "path": "py/wind_reference_model.py",
            "start": 18,
            "end": 18,
            "label": "Rated power constant"
          },
          {
            "path": "py/wind_reference_model.py",
            "start": 29,
            "end": 35,
            "label": "Generic power curve"
          }
        ]
      },
      {
        "id": "speeds",
        "label": "Cut-in / rated / cut-out",
        "value": "3 / 12 / 25",
        "unit": "m/s",
        "evidence": [
          {
            "path": "py/wind_reference_model.py",
            "start": 19,
            "end": 19,
            "label": "Power curve speeds"
          }
        ]
      },
      {
        "id": "hours",
        "label": "Hours per year",
        "value": 8760.0,
        "unit": "h",
        "evidence": [
          {
            "path": "py/wind_reference_model.py",
            "start": 20,
            "end": 20,
            "label": "Hours per year"
          }
        ]
      },
      {
        "id": "means",
        "label": "Mean wind speeds",
        "value": "5.0 .. 10.0 step 0.5",
        "unit": "m/s",
        "evidence": [
          {
            "path": "py/wind_reference_model.py",
            "start": 44,
            "end": 45,
            "label": "Weibull scale from mean"
          }
        ]
      }
    ],
    "inputHash": "de3e05a027f57c5ea70f374a206c631d0c449b2f5669a19d997ffa08c5222804"
  },
  "payload": {
    "kind": "table",
    "rowKey": "id",
    "columns": [
      {
        "id": "id",
        "label": "Case",
        "type": "string"
      },
      {
        "id": "meanSpeed",
        "label": "Mean wind speed",
        "type": "number",
        "unit": "m/s"
      },
      {
        "id": "weibullScale",
        "label": "Weibull scale c",
        "type": "number",
        "unit": "m/s"
      },
      {
        "id": "aep",
        "label": "Annual energy (gross)",
        "type": "number",
        "unit": "MWh/yr"
      },
      {
        "id": "capacityFactor",
        "label": "Capacity factor",
        "type": "number",
        "unit": "%"
      }
    ],
    "rows": [
      {
        "id": "mean-5-0",
        "meanSpeed": 5.0,
        "weibullScale": 5.642,
        "aep": 3229.6,
        "capacityFactor": 12.29
      },
      {
        "id": "mean-5-5",
        "meanSpeed": 5.5,
        "weibullScale": 6.206,
        "aep": 4260.5,
        "capacityFactor": 16.21
      },
      {
        "id": "mean-6-0",
        "meanSpeed": 6.0,
        "weibullScale": 6.77,
        "aep": 5373.6,
        "capacityFactor": 20.45
      },
      {
        "id": "mean-6-5",
        "meanSpeed": 6.5,
        "weibullScale": 7.334,
        "aep": 6528.9,
        "capacityFactor": 24.84
      },
      {
        "id": "mean-7-0",
        "meanSpeed": 7.0,
        "weibullScale": 7.899,
        "aep": 7690.9,
        "capacityFactor": 29.27
      },
      {
        "id": "mean-7-5",
        "meanSpeed": 7.5,
        "weibullScale": 8.463,
        "aep": 8830.5,
        "capacityFactor": 33.6
      },
      {
        "id": "mean-8-0",
        "meanSpeed": 8.0,
        "weibullScale": 9.027,
        "aep": 9925.5,
        "capacityFactor": 37.77
      },
      {
        "id": "mean-8-5",
        "meanSpeed": 8.5,
        "weibullScale": 9.591,
        "aep": 10958.6,
        "capacityFactor": 41.7
      },
      {
        "id": "mean-9-0",
        "meanSpeed": 9.0,
        "weibullScale": 10.155,
        "aep": 11916.8,
        "capacityFactor": 45.35
      },
      {
        "id": "mean-9-5",
        "meanSpeed": 9.5,
        "weibullScale": 10.72,
        "aep": 12790.7,
        "capacityFactor": 48.67
      },
      {
        "id": "mean-10-0",
        "meanSpeed": 10.0,
        "weibullScale": 11.284,
        "aep": 13573.4,
        "capacityFactor": 51.65
      }
    ]
  },
  "representations": [
    {
      "id": "aep-8",
      "title": "AEP at 8 m/s mean",
      "kind": "metric",
      "row": "mean-8-0",
      "column": "aep",
      "unit": "MWh/yr",
      "digits": 0,
      "inputs": [
        "k",
        "ratedPower",
        "speeds",
        "hours"
      ]
    },
    {
      "id": "cf-8",
      "title": "Capacity factor at 8 m/s mean",
      "kind": "metric",
      "row": "mean-8-0",
      "column": "capacityFactor",
      "unit": "%",
      "digits": 1,
      "inputs": [
        "k",
        "ratedPower",
        "speeds",
        "hours"
      ]
    },
    {
      "id": "table",
      "title": "Weibull AEP table",
      "kind": "table"
    },
    {
      "id": "curve",
      "title": "AEP vs mean speed",
      "kind": "chart",
      "chart": "line",
      "x": "meanSpeed",
      "y": "aep",
      "unit": "MWh/yr",
      "inputs": [
        "k",
        "ratedPower",
        "speeds",
        "hours",
        "means"
      ]
    },
    {
      "id": "json",
      "title": "JSON",
      "kind": "json"
    }
  ]
}
