{
  "format": "datapass.artifact",
  "version": 1,
  "id": "foil-wind-sql-per-run",
  "title": "Samples, gaps and means per run",
  "provenance": {
    "kind": "synthetic",
    "source": "HAND-MADE PLACEHOLDER (not FOIL output, not Foil'O physics, invented numbers); SQL executed by sqlite3 at build time",
    "producer": {
      "kind": "script",
      "name": "clients/foil-wind/py/build_data.py"
    },
    "inputs": [
      {
        "id": "dataSource",
        "label": "Data source",
        "value": "hand-made placeholder"
      },
      {
        "id": "producer",
        "label": "Producer",
        "value": "hand-made placeholder"
      },
      {
        "id": "runs",
        "label": "Runs shown",
        "value": 3
      }
    ],
    "inputHash": "90c8548f944110ed878fed53aad4a9c0795a1d76dee6ce44ccdfa68f785b5f01"
  },
  "payload": {
    "kind": "table",
    "rowKey": "row",
    "columns": [
      {
        "id": "row",
        "label": "#",
        "type": "string"
      },
      {
        "id": "slot",
        "label": "slot",
        "type": "string",
        "nullable": false
      },
      {
        "id": "scenario",
        "label": "scenario",
        "type": "string",
        "nullable": false
      },
      {
        "id": "samples",
        "label": "samples",
        "type": "number",
        "nullable": false
      },
      {
        "id": "missing_wind",
        "label": "missing_wind",
        "type": "number",
        "nullable": false
      },
      {
        "id": "mean_wind_ms",
        "label": "mean_wind_ms",
        "type": "number",
        "nullable": false
      },
      {
        "id": "mean_power_kw",
        "label": "mean_power_kw",
        "type": "number",
        "nullable": false
      }
    ],
    "rows": [
      {
        "row": "r001",
        "slot": "run-1",
        "scenario": "calm",
        "samples": 6,
        "missing_wind": 0,
        "mean_wind_ms": 4.917,
        "mean_power_kw": 0.783
      },
      {
        "row": "r002",
        "slot": "run-2",
        "scenario": "breezy",
        "samples": 6,
        "missing_wind": 0,
        "mean_wind_ms": 7.0,
        "mean_power_kw": 1.917
      },
      {
        "row": "r003",
        "slot": "run-3",
        "scenario": "gappy",
        "samples": 6,
        "missing_wind": 2,
        "mean_wind_ms": 5.875,
        "mean_power_kw": 1.083
      }
    ]
  },
  "representations": [
    {
      "id": "table",
      "title": "Samples, gaps and means per run",
      "kind": "table"
    }
  ]
}
